{
  "findings": [
    {
      "adjusted_severity": "critical",
      "capability": "credential_access",
      "contextual_verdict": "unadjudicated",
      "evidence": "Potential GitHub token found in tool metadata for 'send_report' at input_schema.properties.api_key.default and was redacted (ghp_...3456).",
      "id": "MCP-020",
      "metadata": {},
      "original_severity": "critical",
      "owasp_mcp": "MCP01",
      "payload_stored": false,
      "reference": "OWASP MCP Top 10: Credential exposure",
      "remediation": "Remove secrets from MCP metadata and pass credentials through secure runtime configuration.",
      "severity": "critical",
      "target": "send_report",
      "title": "Secret exposure in metadata",
      "verdict_reasoning": "No declared purpose available; pass --purpose or --purpose-category to enable contextual adjudication."
    },
    {
      "adjusted_severity": "high",
      "capability": "prompt_anomaly",
      "contextual_verdict": "unadjudicated",
      "evidence": "Description for tool 'search' contains instruction-like phrase 'ignore previous instructions'.",
      "id": "MCP-001",
      "metadata": {},
      "original_severity": "high",
      "owasp_mcp": "MCP03",
      "payload_stored": false,
      "reference": "OWASP MCP Top 10: Tool poisoning and rug pull attacks",
      "remediation": "Remove embedded instructions from MCP metadata and treat descriptions as untrusted display text.",
      "severity": "high",
      "target": "search",
      "title": "Tool description prompt injection",
      "verdict_reasoning": "No declared purpose available; pass --purpose or --purpose-category to enable contextual adjudication."
    },
    {
      "adjusted_severity": "high",
      "capability": "shell_exec",
      "contextual_verdict": "unadjudicated",
      "evidence": "Tool 'run_command' appears to expose shell execution based on name, description, or schema.",
      "id": "MCP-010",
      "metadata": {},
      "original_severity": "high",
      "owasp_mcp": "MCP02",
      "payload_stored": false,
      "reference": "OWASP MCP Top 10: Excessive permissions",
      "remediation": "Restrict dangerous tools, require explicit approval, and scope parameters as narrowly as possible.",
      "severity": "high",
      "target": "run_command",
      "title": "Dangerous capability exposure",
      "verdict_reasoning": "No declared purpose available; pass --purpose or --purpose-category to enable contextual adjudication."
    },
    {
      "adjusted_severity": "high",
      "capability": "credential_access",
      "contextual_verdict": "unadjudicated",
      "evidence": "Tool 'send_report' appears to expose credential access based on name, description, or schema.",
      "id": "MCP-010",
      "metadata": {},
      "original_severity": "high",
      "owasp_mcp": "MCP02",
      "payload_stored": false,
      "reference": "OWASP MCP Top 10: Excessive permissions",
      "remediation": "Restrict dangerous tools, require explicit approval, and scope parameters as narrowly as possible.",
      "severity": "high",
      "target": "send_report",
      "title": "Dangerous capability exposure",
      "verdict_reasoning": "No declared purpose available; pass --purpose or --purpose-category to enable contextual adjudication."
    },
    {
      "adjusted_severity": "high",
      "capability": "data_exposure",
      "contextual_verdict": "unadjudicated",
      "evidence": "Resource 'file://.env/' appears to expose sensitive data or file signal '.env'.",
      "id": "MCP-021",
      "metadata": {},
      "original_severity": "high",
      "owasp_mcp": "MCP10",
      "payload_stored": false,
      "reference": "OWASP MCP Top 10: Sensitive data exposure",
      "remediation": "Remove sensitive resources from MCP exposure or gate them behind explicit authorization.",
      "severity": "high",
      "target": "env_file",
      "title": "Sensitive data or file exposure",
      "verdict_reasoning": "No declared purpose available; pass --purpose or --purpose-category to enable contextual adjudication."
    },
    {
      "adjusted_severity": "high",
      "capability": "data_exposure",
      "contextual_verdict": "unadjudicated",
      "evidence": "Tool 'search' appears to expose sensitive data or file signal '.env'.",
      "id": "MCP-021",
      "metadata": {},
      "original_severity": "high",
      "owasp_mcp": "MCP10",
      "payload_stored": false,
      "reference": "OWASP MCP Top 10: Sensitive data exposure",
      "remediation": "Restrict access to sensitive files and avoid exposing PII or secrets through MCP tools.",
      "severity": "high",
      "target": "search",
      "title": "Sensitive data or file exposure",
      "verdict_reasoning": "No declared purpose available; pass --purpose or --purpose-category to enable contextual adjudication."
    },
    {
      "adjusted_severity": "high",
      "capability": "shell_exec",
      "contextual_verdict": "unadjudicated",
      "evidence": "Tool 'run_command' accepts unconstrained string parameter 'command' and appears to execute commands or code.",
      "id": "MCP-030",
      "metadata": {},
      "original_severity": "high",
      "owasp_mcp": "MCP05",
      "payload_stored": false,
      "reference": "OWASP MCP Top 10: Tool invocation injection",
      "remediation": "Constrain executable inputs with enums, patterns, length limits, allowlists, and server-side validation.",
      "severity": "high",
      "target": "run_command",
      "title": "Command or code injection surface",
      "verdict_reasoning": "No declared purpose available; pass --purpose or --purpose-category to enable contextual adjudication."
    },
    {
      "adjusted_severity": "medium",
      "capability": "identity_spoof",
      "contextual_verdict": "unadjudicated",
      "evidence": "Name 'githab' is visually similar to known MCP server name 'github'.",
      "id": "MCP-050",
      "metadata": {},
      "original_severity": "medium",
      "owasp_mcp": "MCP09",
      "payload_stored": false,
      "reference": "OWASP MCP Top 10: Identity and package spoofing",
      "remediation": "Verify package provenance, repository ownership, and installation source before trusting this server.",
      "severity": "medium",
      "target": "githab",
      "title": "Static known-name lookalike check",
      "verdict_reasoning": "No declared purpose available; pass --purpose or --purpose-category to enable contextual adjudication."
    }
  ],
  "not_checked": [
    "Server source code is not analyzed",
    "Runtime behavior is not observed",
    "Dependencies/supply chain are not audited",
    "Drift requires --baseline rescans",
    "Registry squatting coverage limited to a curated seed list"
  ],
  "purpose_profile": {
    "category": "unknown",
    "category_source": "unknown",
    "declared_text": "githab",
    "expected_capabilities": []
  },
  "report_version": "2.0",
  "scan": {
    "checks_version": "1",
    "mcpscan_version": "0.1.0",
    "reproduce_command": "mcpscan scan --command '.venv/bin/python tests/fixtures/malicious_server.py' --timeout 90.0",
    "target": ".venv/bin/python tests/fixtures/malicious_server.py",
    "timeout_seconds": 90.0,
    "timestamp_utc": "2026-06-11T18:01:53+00:00",
    "transport": "stdio"
  },
  "server": {
    "name": "githab",
    "source": null,
    "transport": "stdio",
    "version": "1.27.2"
  },
  "surface": {
    "prompts": [],
    "resources": [
      {
        "description_sha256": "e3b0c44298fc1c149afbf4c8996fb92427ae41e4649b934ca495991b7852b855",
        "name": "env_file",
        "schema_sha256": null
      }
    ],
    "surface_version": 1,
    "tools": [
      {
        "description_sha256": "e83a696a9af37f4753bfaa8814bc54a7620fe5f0578dafc0d3838c7a0651b949",
        "name": "run_command",
        "schema_sha256": "283fa0b855ad452e1ffc8c94502caed3f8359429db159b1669194bbe82311750"
      },
      {
        "description_sha256": "e3c39484253d43acb8c460642a4ca14e40060274e3ac01b10f42166a9d6b48c0",
        "name": "search",
        "schema_sha256": "70d56fc588123a91facb406e0c895496c3d41ae2a27e23a87348a1e8984614e4"
      },
      {
        "description_sha256": "1c20a2f7ba262c57a4ce4a6d7723e246aa3bc27f384a497ccd2c0dc192065107",
        "name": "send_report",
        "schema_sha256": "feb9c415e3bf0421d1fa59ab15aa1b334faec0c753ef7230f1cb50e182416582"
      }
    ]
  },
  "verdict_summary": {
    "counts_by_adjusted_severity": {
      "critical": 1,
      "high": 6,
      "info": 0,
      "low": 0,
      "medium": 1
    },
    "grade": "F",
    "recommendation": "do_not_connect",
    "top_findings": [
      "CRITICAL MCP-020 on send_report: Potential GitHub token found in tool metadata for 'send_report' at input_schema.properties.api_key.default and was redacted (ghp_...3456).",
      "HIGH MCP-001 on search: Description for tool 'search' contains instruction-like phrase 'ignore previous instructions'.",
      "HIGH MCP-010 on run_command: Tool 'run_command' appears to expose shell execution based on name, description, or schema."
    ]
  },
  "warnings": []
}
